author,title,isbn,published,edition,location,bought When,bought where,started reading,finished reading,notes
Aderin-Pocock,The Planets,9781409353058,2014,2014,Attic,,,,,
Alloisio,Il Mio amico Giorgio Gaber,9788851149680,2017,2017,Attic 2R,2018,gift by dad,,paused,autografo
"Ambrosini, Cardone, Cuccu",Introduzione al linguaggio del film,9788843075775,2010,2018,Attic 2R,,,,,
Andreoli,Il Rumore delle Parole,9788817109291,2019,2019,Attic 2R,2019-12-25,Christmas gift by Meggie,,,
Arnold,"Aerei, mongolfiere, dirigibili",8884515866,2004,2006,Attic,,,,,
Baccalario,Century – L’Anello di Fuoco,9788856617405,2006,2013,given away,,,,,
Baccalario,Century – La Stella di Pietra,9788856619638,2007,2013,given away,,,,,
Baccalario,Lo spacciatore di fumetti,9788879268936,2011,2011,Attic,,,,,messaggio
Baccalario,Ulysses Moore ,9788856617399,2006,2011,Attic,,,,,
Baccalario,Ulysses Moore 12 - Il Club dei viaggiatori immaginari,9788856618693,2011,2011,Attic,,,,,
Baccalario,Ulysses Moore 2 - La Bottega delle Mappe Dimenticate,9788856613773,2005,2010,???,,,,,
Baccalario,Ulysses Moore 3 - La Casa degli Specchi,9788856614237,2005,2010,???,,,,,
"Baccalario, Gatti",Candy Circle - Il tempio degli scorpioni di smeraldo,8804582227,2008,2008,Attic,,,,,
"Baccalario, Gatti",Candy Circle 1,8804543027,,,lent,,,,,
"Baccalario, Gatti",Candy Circle 2 - Attenti al guru,9788804543039,2005,2005,Attic,,,,,
"Baccalario, Gatti",Candy Circle 3 - Salsicce e misteri,9788804545880,2005,2005,Attic,,,,,
"Baccalario, Gatti",Candy Circle 4 - Tutti addosso al drago rosso,9788804545934,2005,2005,Attic,,,,,
"Baccalario, Gatti",Candy Circle 5 - Quando il bomber fa cilecca---,9788804548201,2005,2005,Attic,,,,,
"Baccalario, Gatti",Candy Circle 6 - Pecore alla deriva,9788804548362,2005,2005,Attic,,,,,
"Baccalario, Gatti",Candy Circle 7 - Faccia di menta,9788804552468,2006,2005,Attic,,,,,
"Baccalario, Gatti",Candy Circle 8 - Chi ha paura del Candy Circle?,9788804554882,2006,2005,Attic,,,,,
"Baccalario, Gatti",I gialli di vicolo Voltaire - La baronessa nel baule,9788856612516,2010,2010,Attic,,,,1,autografo
Baccalario,L'ombra di Amadeus,9788856635300,2013,2013,Attic,,,,,
Baden Powell,Rovering To Success,1000046503,1922,2012,Attic 2R,2019-12-30,Amazon,,,
Barison,Le stelle cadranno tutte insieme,9788860445469,2018,2018,Attic,2018,,2018-05,2018-05,
Battiston,Fare Spazio,9788893448826,2019,2019,Attic,43824,gift by Zio Luca,,,
Battiston,La Prima Alba del Cosmo,9788817141901,2019,2019,Attic 2R,2019-12-25,Christmas gift by Zio Luca,,,
Beinhart,Il bibliotecario,9788809059979,2008,2008,Attic 2R,,,,,
"Bigon, Regazzoni",I nodi,8804355565,1981,1998,Attic,41175,gift by Marina (per Cresima),,,
Borrometi,Un morto ogni tanto,9788828200710,2018,2018,Attic 2R,,,,,
Bosh,Se state leggendo questo libro è già troppo tardi,9788804584957,2008,2009,Attic,,,,,
Brizzi,Il pellegrino dalle braccia d’inchiostro,9788804489450,2007,2007,Attic 2R,2020,cantina,,,
Bruno,Ossidea: La guerra dei giganti,9788862564564,,2012,given away,,,,,
Burgess,A Clockwork Orange,9780241951446,1962,2011,Attic 2R,2019-07-08,gift by Zio Luca,,,dedica
Calvino,Le città invisibili,9788804668022,,2016,Attic 2R,2020-12-25,gift by Zio Luca,,,
Calvino,Orlando Furioso,9788804616962,,2012,Attic,,,,,
Cameron,Someday this pain will be useful to you,9780312428167,2007,,Attic,2019,,,,
Camilleri,Il tailleur grigio,9788804701187,2008,2018,Attic 2R,2018,Salone del Libro,,,
Campioni,Anything is Possible,9791220033824,2018,2018,Attic,43824,gift by famiglia Cicala,,,
Capote,Un Natale,9788811607427,1988,2019,Attic 2R,2020-12-25,Gift by Roberta Sapere,,,dedica
Cardini,L'Islam è una minaccia (Falso!),9788858123690,2016,2016,Attic,2016,gift by Zio Luca,,,
Carnegie,Come diventare un comunicatore eccezionale,9788830100404,2014,2020,Attic 2R,2020-07-07,gift by Ludovica Calza,,,
Caroli,L'arte italiana in quindici weekend e mezzo,9788804687184,2018,2018,Attic 2R,43289,gift by Zio Luca,,,dedica
Carroll,Read this if you want to take great photographs of people-,9781780676241,2015,2015,Attic 2R,2018-06,The Photography Museum London,,,
Castagna,Petrademone 1 - Il Libro delle Porte,9788804684114,2017,2017,Attic,2019-07-20,Amazon,,1,autografo
Castaldo,Il Romanzo della Canzone Italiana,9788806235895,2018,2018,Attic 2R,2021-03-05,gift by Luci,,,
Catalano,Tu Che Non Sei Romantica,9788817109239,2019,2019,Attic,2019-11-28,Amazon,2019-12-03,2019-12-10,
Cavedon,Astronomia,,1980,1980,Attic,ritrovamenti,Zio Luca,,,
Cervini,Santo Stefano al Mare - Chiesa parrocchiale e oratorio,8871720571,,,Attic,,,,,
Champion,Manuale pratico di sopravvivenza per giovani esploratori,9788876964350,2010,2011,Attic,,,,,
"Chiapello, Garavagno",Galeone Liceo,9788866176695,2020,2020,Attic 2R,2020-08-02,gift by mum and dad,,,didica mamma e papà + autografo Duccio
Christie,Assassinio sull'Orient Express,,1933,1991,Attic,ritrovamenti,cantina,,,
Christie,Avversario segreto,9788804649083,1922,2015,Attic 2R,,,,,
Christie,Dieci Piccoli indiani,9788804616986,1939,2016,Attic,,,,,
Christie,In tre contro il delitto,8804398108,1981,1990,?,,,,,
Christie,Miss Marple: Le ricette del delitto,,"1964, 1965, 1971",1982,Attic,ritrovamenti,cantina,,,
Christie,Monsieur Poirot: 4 casi del celebre investigatore,,"1923, 1926, 1933, 1946",1983,Attic,ritrovamenti,cantina,,,
Codogno,Matematica in pausa caffè,9788875784546,2014,2014,Attic,,,,,
Conan Doyle,Sherlock Holmes - Investigatore Privato,8841531851,-,2003,Attic,,gift by Zio Gian,,,dedica
Conan Doyle,Sherlock Holmes - tutti i romanzi,9788806199623,-,2013,Attic,,,,,
Conan Doyle,Tutto Sherlock Holmes,9788854113671,-,2013,Attic,,gift by someone,,,
Cotto,Rock Live,9788804718390,2019,2019,Attic,2019-12-25,gift by Fra Maccario,,,
Cristoforetti,Diario di un’apprendista astronauta,9788893445757,2018,2019,Attic 2R,2019-11-07,Amazon,,,autografo
Daniele,La farfalla d'oro,9788888591513,2009,2009,Attic,2010,gift by Dario Daniele,,,
Daniele,Vorrei essere un gatto,9788894917284,2019,2019,Attic 2R,,gift by Dario Daniele,,,dedica e autografo di Dario e Sara (illustratrice)
Dave The Chimp,Ways to deal,,2011,2012,Attic,,swag at workshop magazzini del vapore Milano,,,
De Bono,Il Pensiero Laterale,9788817117272,1969,2004,Venezia,2020-09-29,used books stand in Venezia,,,
De Castellane,L’Arte di essere povero,9788861581098,1925,2009,Venezia,2020-09-29,used books stand in Venezia,,,
De Fombelle,Tobia,9788821558931,2006,2009,Attic,,,,,
de Saint-Exupéry,Il piccolo principe,9788845230455,1943,2011,Attic,2012-07,Vacanze di Branco,,,dedica
"De Silva, Amlo",Degenerati,9788897089858,2015,2015,Attic,2019-09-15,event,2019-12-10,2019-12-18,autografo
Descartes,Meditations on First Philosophy,9781107665736,1986,2017,Venezia,2020-09-25,Amazon,,,
Dostoevskij,Delitto e Castigo,9788804671879,1866,2017,Attic,,gift by Zio Luca,1,,
Duckett,HTML and CSS,9781118008188,2011,2011,Attic,2020-03,Amazon,,,
Duckett,JavaScript & jQuery,9781118531648,2014,2014,Attic,2020-03,Amazon,,,
Dumas,Il Conte di Montecristo,9788806225186,,2015,Attic,,gift by Zio Luca,,,
"Einstein, Infeld",L’evoluzione della fisica,9788833922584,1965,2011,Attic 2R,,Amazon,,,
Evans,Manuale pratico di vela,9788864910208,2001,2011,Attic,,,,,
Eyal,Indistractable: How to Control Your Attention and Choose Your Life,9781526610225,2020,2020,Attic 2R,2019-10-08,Amazon,,,
"Faraci, Wallie",Un sogno chiamato Giffoni,9788807550591,2020,2020,Attic 2R,2020-08-29,gift by Giffoni,,,
Feynman,QED,9788845925344,1985,2019,Attic,,gift by Zio Luca,,,
Feynman,Sei Pezzi Facili,9788845915512,1963,2000,Attic,Natale,gift by Mattia Cretarola,,,
Finnegan,Giorni Selvaggi,9788898970582,2015,2020,Attic 2R,2020-07-08,gift by Camilla Cianci e Alessandro Rebora,,,
Fofi,Il secolo dei giovani e il mito di James Dean,9788834604731,2020,2020,Attic,2020-12-25,gift by mum and dad,2020-12-25,,
Foschi,Il castigo di Attila,9788866322153,2012,2012,Attic,,,,1,
Frey,Endgame,9788842925019,2014,2014,Attic,,gift by Fra,,,
Frova,Perché accade ciò che accade,9788817107976,1995,2014,Attic,,gift by Claudia Carli,,,
Gardner,Enigmi e giochi matematici,9788817127479,1959,2010,Attic,2014,,,,
Gardner,The Ambidextrous Universe,,1964,1970,Attic,2018-06,London,,,indirizzo di Elena Leonardi nella prima pagina
Geda,Per il resto del viaggio ho sparato agli indiani,9788807720765,2009,2010,Attic 2R,2012-12,gift by Miti to mum,,,dedica
Goethe,I dolori del Giovane Werther,8883373456,,2019,Attic,2019-12-30,Amazon,2020-04,43936,
"Goso, Don Diego",Il manuale del perfetto chierichetto,9788869292545,2017,2017,Attic,43232,gift by Mimmo Marrara,,,
Gozzano,Tutte le Poesie,9781545508220,-,-,Attic,2019-10-18,Amazon,,,
Green,Città di carta,9788817082556,2008,2015,Attic,,gift by Fra,,,dedica
Gregson,Sherlock Holmes e il mistero del golf club,9788889096901,1998,2008,Attic,,,,,
Grisham,Theodore Boone: kid lawyer,9780142417225,2010,2010,Attic,,,,,
Grisham,Theodore Boone: L'accusato,9788804618799,2012,2012,Attic,,,,1,
Grisham,Theodore Boone: La Ragazza Scomparsa,9788804613343,2011,2011,gift to Matteo Boniardi,,,,1,
Grisham,Theodore Boone: The Abduction,9781444714548,2012,2012,Attic,,,,,
"Guccini, Macchiavelli",La pioggia fa sul serio,9788804701187,2014,2018,Attic 2R,2018-05,Salone del Libro di Attic,,,
Gungui,Achille e la fuga dal mondo bianco,9788804593133,2009,2009,Attic,,,,1,
Halpern,I dadi di Einstein e il gatto di Schrödinger,9788860308092,2015,2016,Attic,43289,gift by Giacomo Borghi,,,
Hans M- Enzensberger,Il mago dei numeri,9788806173043,1997,2011,Attic,40902,,,,dedica
Hawking,La chiave segreta per l'universo,9788804591894,2007,2010,Attic,40902,gift by Jari Marenco e Elisa,,,
Hemingway,The first forty-nine stories,9780099339212,-,2004,Attic,2018-07-18,Amazon,,,
Hume,An Enquiry concerning Human Understanding,9780199211586,1748,2007,Venezia,2020-09-29,Amazon,,,
Jamar,Vincent,9782505064138,2016,2016,Attic bottom,,gift by Zio Luca,,,
Jane Shaw,London Guide,9780241277300,1993,2017,Attic,,,,,
Jaynes,Sherlock Holmes e lo squartatore di Chilford,9788895724140,2005,2008,Attic,,,,,
Jovanotti Cherubini,Gratitude,9788806218348,2013,2016,Attic 2R,2016,gift by Zia Alda,,,
Joyce,Ulysses,9781840226355,1922,2010,Attic 2R,2019-12-30,Amazon,,,
Kahneman,Pensieri lenti e veloci,9788804671954,2011,2017,Attic 2R,43289,gift by Vlad e Luca Chiaia,,,
Kakalios,La Fisica dei supereroi,9788806221485,2005,2014,Attic,Natale,gift by Claudia Carli,,,
Kasius,Sherlock Holmes - The essential mysteries in one sitting,9780762448692,2013,2013,Attic,,,,,
Kipling,Il libro della Giungla,9788809765986,2995,2017,Attic,,,,,
Kipling,The Jungle Book & The Second Jungle Book,9781840227550,"1894, 1895",2018,Attic 2R,2020-01-05,Amazon,,,
Lanier,Ten Arguments For Deleting Your Social Media Accounts,9781250196682,2018,2018,Attic,2020-08-29,Amazon,2020-09-10,2020-09-15,
Lane,Young Sherlock Holmes - Ghiaccio Sporco,9788841885680,2011,2013,Attic,,,,,
Lane,Young Sherlock Holmes - Tempesta Assassina,9788841896488,2011,2014,Attic,,,,,
Lewis,Le Cronache di Narnia 2,9788804599043,1950,2010,Attic,,,,,
Lewis,Le Cronache di Narnia 3,9788804599067,1954,2010,Attic,,,,,
Lewis,Le Cronache di Narnia 4,9788804599036,1951,2010,Attic,,,,,
Lewis,Le Cronache di Narnia 5,9788804599098,1952,2010,Attic,,,,,
Lewis,Le Cronache di Narnia 6,9788804599081,1953,2010,Attic,,,,,
Lewis,Le Cronache di Narnia 7,9788804599074,1956,2010,Attic,,,,,
"Liotta, Clementi",La rivolta della natura,9788834603659,2020,2020,Attic 2R,2020-07-08,gift by Luci,,,
London,L'amore della vita,8870687554,,1995,Attic,,,,,
Lupi,Vittò - Giuseppe Vittorio guglielmo,9788862883191,2011,2016,Attic,2019,ANPI Sanremo,,,
Machiavelli,Il Principe,9771824876355,,2006,Attic 2R,2021-02-27,"Commercio equo, Padova",,,acquistato usato a 3€
Marziale,Epigrammi,9788817129800,-,2018,Attic,2019-10-18,Amazon,,,testo latino a fronte
Mazzariol,Gli Squali,9788806237462,2018,2019,Attic,43654,gift by mum and dad,,,dedica e autografo fatto a Giffoni 2019
Mercanti,Le attività del Trapper,9788830405820,1979,1987,Attic,,Zio Luca,,,messaggio iniziale
Micela,Nascita e morte delle stelle,9788815258144,2015,2015,Attic,,gift by Zio Luca,,,
Minà,Storia di un boxeur latino,9788833891651,2020,2020,Attic,2020-07-08,gift by mum and dad,2020-07-13,2020-07-20,dedica
Minuto,Atlante del Cielo,885390030X,,,Attic,2016-09,Saint Barthelemy,,,
Molinari,Il califfato del terrore,9788817085120,2015,2016,Attic 2R,2016,gift by Zio Luca,,,
Molnar,I Ragazzi della via Paal,,,1982,Attic,,,,,
Montesano,Come diventare vivi: Vademecum per lettori selvaggi,9788845295263,2017,2017,Attic,!,Salone del Libro di Attic,!,!,autografo
Moore,L'uomo che odiava Sherlock Holmes,9788817047241,,2012,Attic,42840,gift by Zio Gian,,,dedica
Morosinotto,La notte dei biplani,9788834717486,2011,2011,Attic 2R,,,,,
Murakami,L'assassinio del governatore,9788806237615,2017,2018,Attic 2R,,,,,
Murch,In un batter d’occhi,9788867088591,2000,2018,Attic 2R,2020-07-07,"gift by Lele, Bene Capponi, Steff, Gaia Santone",,,
Navarro,What Every Body Is Saying,9780061438295,2008,,Attic 2R,2019-11-28,Amazon,,,
Neil,Practical Vim,9781680501278,2015,2017,Attic,2020-03,gift by Nonna Gogò,,,
Neri,Radiotecnica per radioamatori,8886622015,2017,2017,Bedroom,,,,,
O’Connor,Complete Stories,9780571245789,various,2009,Venezia,2020-08-04,gift by zio Luca,,,
Orwell,Animal Farm,9780141036137,1945,2008,Attic,2017,gift by Zio Luca,,1,
Orwell,Nineteen Eighty-Four,9780241341650,1949,2000,Attic 2R,2020-12-25,gift by zio Luca,,,
Papa Francesco,Christus vivit,97888892218918,2019,2019,Attic 2R,,,,,
Papa Francesco,Fratelli tutti,+++,+++,+++,Venezia,2021-02-19,gift by CoCa Mira 1,,,
Percivale,Messaggio dall'Impossibile,9788866562375,,2015,Attic,,,,,
Percivale,Ribelli in fuga,9788866560548,2013,2013,Attic,,,,1,
Percivale,Typos 0.3 Rivelazione,9788834719299,2012,2012,Attic,,,,,
"Pini, Don Gigi",Un po' del Vangelo di Giovanni,,-,-,Attic 2R,2019-08-03,gift by Don Gigi Pini,,,dedica e autografo di Don Gigi
Quirico,Testimoni del nulla,9788858141205,2020,2020,Attic 2R,2020-12-25,gift by mum and dad,,,
Rampini,Oriente e Occidente,9788806245481,2020,2020,Attic 2R,2020-08-02,gift by dad,,,autografo
Rampini,Rete padrona,9788807887185,2014,2014,Attic,,,,,
Randall,Hyperversum 1 - Il falco e il leone,9788809750395,2007,2010,?,,gift by Zio Luca,,1,
"Ridpath, Tirion",guida delle stelle e dei pianeti,8870213072,1984,1986,Attic,,,,,
Riotta,Il mondo di Steve McCurry,9788891800237,,,Attic,,gft by mum and dad,,,
Roggero,Polo Nord e Polo Sud - Viaggio ai confini della terra,9788817062480,2012,2012,Attic,,,,,
"Rondolino, Tomasi",Manuale di Storia del cinema,9788860084064,2014,2018,Attic 2R,,Amazon,,,
Roskin,Political Science,9781292156248,1988,2017,reading,2021-02-10,Al Canal,2021-02-10,,printed copy
Rowling,Gli animali fantastici: dove trovarli,9788862562690,2001,2010,Attic,,,,,
Rowling,Harry Potter and The Chamber of Secrets,9781408855669,1998,2014,Attic,,,,,
Rowling,Harry Potter and The Philosopher Stone,9781408810545,1997,2010,Attic,,,,,
Rowling,Harry Potter and The Prisoner of Azkaban,9781408865415,1999,2015,Attic,2019,Amazon,2019-12-18,-,
Rowling,Harry Potter e i doni della morte,9788862562836,2007,2010,Attic,,,,,
Rowling,Harry Potter e il calice di fuoco,9788862561518,2000,2009,Attic,,,,,
Rowling,Harry Potter e il prigioniero di Azkaban,9788884516121,1999,2009,Attic,,,,,
Rowling,Harry Potter e il principe mezzosangue,9788884516374,2005,2009,Attic,,,,,
Rowling,Harry Potter e l'ordine della fenice,9788862561525,2003,2009,Attic,,,,,
Rowling,Harry Potter e la camera dei segreti,9788877827036,1998,2009,Attic,,gift by Nonna Gogò,,,
Rowling,Il Quidditch attraverso i secoli,9788862562706,2001,2010,Attic,,,,,
Schopenhauer,L'arte d insultare,9788845914805,,2019,Attic,2019,,,,
Schopenhauer,L'arte di conoscere se stessi,9788845917721,,2019,Attic,2019,,,,
Schopenhauer,L'arte di essere felici,9788845912955,,2019,lent to Marta Mallucci,2019,,2020-07-20,2020-07-27,
Schopenhauer,L'arte di farsi rispettare,9788845913747,,2019,Attic,2019,,,,
Schopenhauer,L'arte di ottenere ragione,9788845908569,,2019,Attic,2019,,,,
Scola,Postcristianesimo?,9788831727099,2017,2017,Venezia,2020-09-29,used books stand in Venezia,,,
Scott Fitzgerald,Il grande Gatsby,,,1998,Attic,,,,,
Seil,Sherlock Holmes e la tragedia del Titanic,9788895724560,1996,2009,Attic,41345,gift by Zio Gian,,1,dedica
Selznick,La straordinaria invenzione di Hugo Cabret,9788804614159,2011,2011,Attic,,,,,
Sgardoli,Typos 0.2 Cartabianca,9788834719282,2012,2012,Attic,,,,,autografo
Shultz,Aerei di carta,8873072860,2004,2004,Attic,,gift by ,,,
Simenon,I Fantasmi del Cappellaio,9788845926730,1948,2016,Attic,,,,,
Simenon,Maigret e i testimoni reticenti,,1961,1977,Attic,ritrovamenti,cantina,,,
Simeone,Semplice,9788897165415,2012,2012,Attic,,,,1,autografo
Sparrow,Physics in munutes,9781782066484,2014,2014,Attic,,,,,
Sterne,"The life and opinions of Tristram Shandy, Gentleman",9781853262913,1996,2009,Attic,2019,Amazon,,,
Stevenson,L'isola del tesoro,9788861752412,,2007,Attic,,,,,
Stevenson,Lo strano caso del Dr. Jekyll e del Sig. Hyde,,1983,1988,Attic,,,,,
Svevo,La coscienza di Zeno,8806118269,1923,1990,Attic,,,,,
Swift,Gulliver’s Travels,9781853260278,1726,2001,Attic 2R,2020-01-05,Amazon,,,
Teatro Regio Attic,Carmen - libretto,18253504,2019,2019,Attic,2019-12-10,event,1,,
Teatro Regio Attic,Nabucco - libretto,18253504,2020,2020,Attic,,,,,
Teatro Regio Attic,Tosca - libretto,18253504,2019,2019,Attic,2019-10-18,event,1,,
Thich Nhat Hanh,The art of communicating,9781846044007,2013,2013,Attic 2R,,,,,
Tolkien,Il signore degli anelli,9788845210273,1955,2007,Attic,,gift by Miti,,,dedica
Tolkien,Lo Hobbit,9788845927553,1937,2012,Attic,,gift by Zio Luca,,,
Trova,Sentieri di Frontiera,9788877072207,2014,2014,Attic,Pasqua 2016,gift by Zio Gian,,,
Truffaut,Il cinema secondo Hitchcock,9788842820086,1993,2017,Attic 2R,2019,Amazon,,,
Twain,Le Avventure di Tom Sawyer,9788879264846,1981,2004,Attic,,,,,
Vaschetto,Sentieri sul Mare,9788877071392,2011,2014,Attic,42527,Recco,,,
Verne,Cèsar Cascabel,,,,Attic,ritrovamenti,Zio Luca,,,
Verne,"I figli del capitano Grant, vol. 1 (Australia e Oceano Pacifico)",9788842537304,1967,2009,Attic,,,,,
Verne,"I figli del capitano Grant, vol. 2 (America del sud)",9788842537298,1968,2009,Attic,,,,,
Verne,Il giro del mondo in ottanta giorni,9788861753020,,2008,Attic,40012,Vacanze di Branco,,,dedica
Verne,Il giro del mondo in ottanta giorni,9788861753020,2008,2008,Attic,,,,,
Verne,L'isola misteriosa,9788841846810,,2010,Attic,,,,,
Verne,Ventimila leghe sotto i mari,9788841860021,,2011,Attic,,,,,
Verne,Viaggio al centro della terra,9788865260999,1862,2012,Attic,,,,,
Vincent,A history of Solitude,9781509536580,2020,Polity Press,Attic 2R,2020-12-25,gift by mum and dad,,,dedica
Viola,Bikesofia - Filosofia della bicicletta,9788869832154,2019,2019,Attic 2R,2019-12-25,Christmas gift by famiglia Cicala,,,autografo
Voltaire,Lettere Filosofiche,,,1992,Attic,,,,,
Warburton,"Philosophy, the basics",9780415693165,1992,2013,Attic,2020-12-28,Amazon,1,2021-01-10,
Wilde,The Picture of Dorian Gray,9781853260155,1890,2001,Attic 2R,2020-01-05,Amazon,,,
Williams,Il grande libro dei fatti straordinari,9788836545667,2001,2008,Attic,,,,,
Wilson,Il grande libro dei misteri irrisolti,888289732X,2000,2003,Attic,,gift by Luci,,,
,Atlante geografico moderno,8841554002,1999,1999,Attic,,,,,
,Catechismo della Chiesa Cattolica - Compendio,8821555062,2005,2005,Attic,,gift by nonno Bruno,,,
,Le risposte dell'oracolo,9788863864618,,,Attic,,,,,
,"Nodi per la barca, lo sport e il tempo libero",9788841203934,2011,2011,Attic,,,,,
,Star Wars - La guida ai personaggi dalla A alla Z,9788898937004,2011,2014,Attic,2017,Feltrinelli Genova,,,
,The Photography Book,071483937X,1997,2000,Attic,2018-06,in a stand in London,1,,
Lamanna,Letture Filosofiche – Dal Rinascimento a Kant,8800453457,1988,1988,Venezia,2021-04-30,"Book crossing shelf Santa Elena, Venezia",,,
Conan Doyle,Il mondo perduto,8845251608,1967,2002,Venezia,2021-04-30,"Book crossing shelf Santa Elena, Venezia",,,
